{
  "schemaVersion": 1,
  "kind": "estimated-human-motion",
  "sourceSHA256": "bbbf1cc6327952be2c75a8b75256e83f0865e8933840bffc0407f4420e0de6c2",
  "window": [
    11.45,
    13.75
  ],
  "skeleton": "H36M17",
  "jointNames": [
    "pelvis",
    "right_hip",
    "right_knee",
    "right_ankle",
    "left_hip",
    "left_knee",
    "left_ankle",
    "spine",
    "neck",
    "nose",
    "head",
    "left_shoulder",
    "left_elbow",
    "left_wrist",
    "right_shoulder",
    "right_elbow",
    "right_wrist"
  ],
  "coordinates": "camera-x-right-y-down-z-depth-root-relative",
  "units": "normalized-estimated-not-meters",
  "sourceTimes": [
    11.45,
    11.483333333333333,
    11.516666666666666,
    11.549999999999999,
    11.583333333333332,
    11.616666666666665,
    11.649999999999999,
    11.683333333333334,
    11.716666666666667,
    11.75,
    11.783333333333333,
    11.816666666666666,
    11.85,
    11.883333333333333,
    11.916666666666666,
    11.95,
    11.983333333333333,
    12.016666666666666,
    12.049999999999999,
    12.083333333333332,
    12.116666666666667,
    12.15,
    12.183333333333334,
    12.216666666666667,
    12.25,
    12.283333333333333,
    12.316666666666666,
    12.35,
    12.383333333333333,
    12.416666666666666,
    12.45,
    12.483333333333333,
    12.516666666666666,
    12.55,
    12.583333333333332,
    12.616666666666667,
    12.65,
    12.683333333333334,
    12.716666666666667,
    12.75,
    12.783333333333333,
    12.816666666666666,
    12.85,
    12.883333333333333,
    12.916666666666666,
    12.95,
    12.983333333333333,
    13.016666666666666,
    13.05,
    13.083333333333334,
    13.116666666666667,
    13.15,
    13.183333333333334,
    13.216666666666667,
    13.25,
    13.283333333333333,
    13.316666666666666,
    13.35,
    13.383333333333333,
    13.416666666666666,
    13.45,
    13.483333333333334,
    13.516666666666666,
    13.55,
    13.583333333333334,
    13.616666666666667,
    13.65,
    13.683333333333334,
    13.716666666666667,
    13.75
  ],
  "positions": [
    [
      [
        0,
        0,
        0
      ],
      [
        -0.09194815903902054,
        -0.015718353912234306,
        -0.035689663141965866
      ],
      [
        -0.1981205940246582,
        0.22184762358665466,
        0.03889669477939606
      ],
      [
        -0.31455716490745544,
        0.4831983149051666,
        0.12094876915216446
      ],
      [
        0.09372592717409134,
        -0.014570442959666252,
        -0.030777428299188614
      ],
      [
        0.2830832600593567,
        0.21085891127586365,
        -0.038948480039834976
      ],
      [
        0.5037018060684204,
        0.4743897616863251,
        -0.04845086485147476
      ],
      [
        0.008388575166463852,
        -0.18199968338012695,
        0.07826606929302216
      ],
      [
        0.016620980575680733,
        -0.35668665170669556,
        -0.018897509202361107
      ],
      [
        -0.06326080113649368,
        -0.5117458701133728,
        -0.07927623391151428
      ],
      [
        -0.10324941575527191,
        -0.5891458988189697,
        -0.048073261976242065
      ],
      [
        0.15512819588184357,
        -0.3565015494823456,
        -0.035345397889614105
      ],
      [
        0.16573326289653778,
        -0.15250582993030548,
        -0.12248867005109787
      ],
      [
        0.017541248351335526,
        -0.16393247246742249,
        -0.23094402253627777
      ],
      [
        -0.12190166115760803,
        -0.359942764043808,
        -0.00393010163679719
      ],
      [
        -0.29387807846069336,
        -0.22000819444656372,
        0.05404353141784668
      ],
      [
        -0.42104336619377136,
        -0.2734564542770386,
        -0.04886331409215927
      ]
    ],
    [
      [
        0,
        0,
        0
      ],
      [
        -0.09131697565317154,
        -0.013190170750021935,
        -0.04202113300561905
      ],
      [
        -0.18961310386657715,
        0.22669675946235657,
        0.041900936514139175
      ],
      [
        -0.2963674068450928,
        0.4880622327327728,
        0.13335278630256653
      ],
      [
        0.09216134250164032,
        -0.011198321357369423,
        -0.03444104641675949
      ],
      [
        0.28602921962738037,
        0.21282000839710236,
        -0.046289969235658646
      ],
      [
        0.5099902153015137,
        0.4735780656337738,
        -0.0600065216422081
      ],
      [
        0.00833277776837349,
        -0.18037672340869904,
        0.07892294228076935
      ],
      [
        0.01679905876517296,
        -0.35389068722724915,
        -0.023902900516986847
      ],
      [
        -0.06600596755743027,
        -0.5076627731323242,
        -0.07643906772136688
      ],
      [
        -0.1075281873345375,
        -0.5856192708015442,
        -0.05025940015912056
      ],
      [
        0.15425604581832886,
        -0.35168543457984924,
        -0.04250578582286835
      ],
      [
        0.16246284544467926,
        -0.1457141637802124,
        -0.12371335923671722
      ],
      [
        0.009266972541809082,
        -0.1602410078048706,
        -0.2252284735441208
      ],
      [
        -0.12194608896970749,
        -0.3563106954097748,
        -0.010066788643598557
      ],
      [
        -0.2936379909515381,
        -0.2156173288822174,
        0.053065720945596695
      ],
      [
        -0.4185199737548828,
        -0.2665361762046814,
        -0.04769216105341911
      ]
    ],
    [
      [
        0,
        0,
        0
      ],
      [
        -0.09121023863554001,
        -0.009556065313518047,
        -0.04799271002411842
      ],
      [
        -0.17722755670547485,
        0.23454801738262177,
        0.04503227025270462
      ],
      [
        -0.26943790912628174,
        0.4970945119857788,
        0.14516526460647583
      ],
      [
        0.09172490984201431,
        -0.007711604703217745,
        -0.037927791476249695
      ],
      [
        0.28756651282310486,
        0.21773777902126312,
        -0.053680457174777985
      ],
      [
        0.5135703086853027,
        0.4782305955886841,
        -0.07183599472045898
      ],
      [
        0.005473476834595203,
        -0.18054239451885223,
        0.07799980044364929
      ],
      [
        0.011089591309428215,
        -0.3517037034034729,
        -0.022114815190434456
      ],
      [
        -0.07140008360147476,
        -0.5088053941726685,
        -0.07759381830692291
      ],
      [
        -0.11275377124547958,
        -0.5877457857131958,
        -0.05178985372185707
      ],
      [
        0.14703813195228577,
        -0.3479451835155487,
        -0.050156641751527786
      ],
      [
        0.14239999651908875,
        -0.13704141974449158,
        -0.12502463161945343
      ],
      [
        -0.016249820590019226,
        -0.15959827601909637,
        -0.21873266994953156
      ],
      [
        -0.1267046332359314,
        -0.35532820224761963,
        -0.01651904359459877
      ],
      [
        -0.2899230122566223,
        -0.2108340859413147,
        0.05493758246302605
      ],
      [
        -0.4180384874343872,
        -0.25888487696647644,
        -0.05007816478610039
      ]
    ],
    [
      [
        0,
        0,
        0
      ],
      [
        -0.09035466611385345,
        -0.007997747510671616,
        -0.053088147193193436
      ],
      [
        -0.1672232449054718,
        0.23647060990333557,
        0.047753170132637024
      ],
      [
        -0.24912074208259583,
        0.49818509817123413,
        0.15579499304294586
      ],
      [
        0.09073857963085175,
        -0.00444111367687583,
        -0.040641698986291885
      ],
      [
        0.2878013849258423,
        0.22452490031719208,
        -0.061273664236068726
      ],
      [
        0.5109962224960327,
        0.4839596748352051,
        -0.08463925868272781
      ],
      [
        -0.0014418195933103561,
        -0.18104347586631775,
        0.07807186245918274
      ],
      [
        -0.0018767359433695674,
        -0.35506150126457214,
        -0.025386208668351173
      ],
      [
        -0.0838787853717804,
        -0.5128533244132996,
        -0.07497827708721161
      ],
      [
        -0.12488894164562225,
        -0.5929434895515442,
        -0.05388664826750755
      ],
      [
        0.1314300149679184,
        -0.35170748829841614,
        -0.05582893639802933
      ],
      [
        0.12672148644924164,
        -0.14082929491996765,
        -0.1266346573829651
      ],
      [
        -0.03108818084001541,
        -0.16494888067245483,
        -0.2145499438047409
      ],
      [
        -0.13745777308940887,
        -0.35970085859298706,
        -0.023136107251048088
      ],
      [
        -0.2890859544277191,
        -0.20916084945201874,
        0.053460679948329926
      ],
      [
        -0.41750791668891907,
        -0.2558567523956299,
        -0.04845425859093666
      ]
    ],
    [
      [
        0,
        0,
        0
      ],
      [
        -0.08738671243190765,
        -0.007221543695777655,
        -0.05682841315865517
      ],
      [
        -0.15188071131706238,
        0.23834802210330963,
        0.04998321458697319
      ],
      [
        -0.22044308483600616,
        0.5004709362983704,
        0.16412796080112457
      ],
      [
        0.08742504566907883,
        -0.004594297148287296,
        -0.04118854179978371
      ],
      [
        0.2755654454231262,
        0.2278008610010147,
        -0.06861893087625504
      ],
      [
        0.4894427955150604,
        0.49190059304237366,
        -0.09978854656219482
      ],
      [
        -0.0032491351012140512,
        -0.1824909746646881,
        0.07496308535337448
      ],
      [
        -0.005177892744541168,
        -0.3560217618942261,
        -0.024310503154993057
      ],
      [
        -0.09091765433549881,
        -0.5118985176086426,